{
  "schema_version": "effects.v1",
  "effect_seed": 834710,
  "project_id": "project-123",
  "render_id": "render-456",
  "effects": [
    {
      "type": "zoom_in",
      "start_ms": 0,
      "end_ms": 1600,
      "strength": 0.08
    },
    {
      "type": "flash_transition",
      "at_ms": 15000,
      "duration_ms": 240
    },
    {
      "type": "shake",
      "start_ms": 8000,
      "end_ms": 8800,
      "strength": 0.05
    }
  ]
}
